{
  "style_id": "radio-talk",
  "style_name": "ラジオ形式",
  "description": "二人の掛け合いで技術トピックを解説する対話形式",
  "format": {
    "speaker_mode": "dialogue",
    "speaker_count": 2,
    "speaker_roles": [
      { "role": "lead", "utterance_share": 0.65 },
      { "role": "questioner", "utterance_share": 0.35 }
    ]
  },
  "pacing": {
    "target_duration_minutes": { "min": 10, "max": 12 },
    "utterance_length": {
      "target_chars": 120,
      "max_chars": 200
    },
    "section_transition_style": "verbal_bridge",
    "pause_between_sections_ms": 800,
    "reflection_pause_ms": 3000
  },
  "language": {
    "formality": "polite",
    "sentence_endings": "mixed",
    "technical_term_treatment": "define_on_first_use",
    "code_verbalization": "structure_then_meaning"
  },
  "segment_structure": {
    "chat_content_ratio": 0.15,
    "opening_style": "casual_greeting",
    "closing_style": "preview_next",
    "allow_tangent": true,
    "repetition_strategy": "key_points_repeated"
  },
  "interaction": {
    "question_frequency": "per_section",
    "listener_address": "occasional",
    "reaction_utterances": true
  },
  "content_treatment": {
    "analogy_usage": "per_concept",
    "example_density": "moderate",
    "humor_level": "light",
    "emphasis_technique": "question_answer"
  }
}
